root@lamp-ubuntu-s-4vcpu-8gb-tor1-01:~# tcpdump -c 5 -i eth0
tcpdump: verbose output suppressed, use -v or -vv for full protocol decode
listening on eth0, link-type EN10MB (Ethernet), capture size 262144 bytes
16:32:48.883847 IP lamp-ubuntu-s-4vcpu-8gb-tor1-01.ssh > 198.211.111.194.42565: Flags [P.], seq 2504686279:2504686407, ack 4122706133, win 501, options [nop,nop,TS val 3863972790 ecr 4231287410], length 128
16:32:48.883930 IP lamp-ubuntu-s-4vcpu-8gb-tor1-01.ssh > 198.211.111.194.42565: Flags [P.], seq 128:320, ack 1, win 501, options [nop,nop,TS val 3863972791 ecr 4231287410], length 192
16:32:48.883964 IP lamp-ubuntu-s-4vcpu-8gb-tor1-01.ssh > 198.211.111.194.42565: Flags [P.], seq 320:384, ack 1, win 501, options [nop,nop,TS val 3863972791 ecr 4231287410], length 64
16:32:48.884765 IP lamp-ubuntu-s-4vcpu-8gb-tor1-01.47073 > 67.207.67.3.domain: 11135+ [1au] PTR? 194.111.211.198.in-addr.arpa. (57)
16:32:48.884859 IP lamp-ubuntu-s-4vcpu-8gb-tor1-01.45999 > 67.207.67.3.domain: 49166+ [1au] PTR? 194.111.211.198.in-addr.arpa. (57)
5 packets captured
41 packets received by filter
5 packets dropped by kernel