4.012523 IP lamp-ubuntu-s-4vcpu-8gb-tor1-01.ssh > 162.243.188.66.54220: Flags [P.], seq 3345376:3346016, ack 3841, win 501, options [nop,nop,TS val 1064876331 ecr 2946070972], length 640
17:17:54.012542 IP lamp-ubuntu-s-4vcpu-8gb-tor1-01.ssh > 162.243.188.66.54220: Flags [P.], seq 3346016:3346272, ack 3841, win 501, options [nop,nop,TS val 1064876331 ecr 2946070972], length 256
17:17:54.012571 IP 162.243.188.66.54220 > lamp-ubuntu-s-4vcpu-8gb-tor1-01.ssh: Flags [.], ack 3218880, win 1015, options [nop,nop,TS val 2946070972 ecr 1064876317], length 0
17:17:54.012583 IP lamp-ubuntu-s-4vcpu-8gb-tor1-01.ssh > 162.243.188.66.54220: Flags [P.], seq 3346272:3346528, ack 3841, win 501, options [nop,nop,TS val 1064876331 ecr 2946070972], length 256
17:17:54.012607 IP lamp-ubuntu-s-4vcpu-8gb-tor1-01.ssh > 162.243.188.66.54220: Flags [P.], seq 3346528:3346784, ack 3841, win 501, options [nop,nop,TS val 1064876331 ecr 2946070972], length 256
17:17:54.012626 IP lamp-ubuntu-s-4vcpu-8gb-tor1-01.ssh > 162.243.188.66.54220: Flags [P.], seq 3346784:3347024, ack 3841, win 501, options [nop,nop,TS val 1064876331 ecr 2946070972], length 240
17:17:54.012634 IP lamp-ubuntu-s-4vcpu-8gb-tor1-01.ssh > 162.243.188.66.54220: Flags [P.], seq 3347024:3347280, ack 3841, win 501, options [nop,nop,TS val 1064876331 ecr 2946070972], length 256
17:17:54.012643 IP lamp-ubuntu-s-4vcpu-8gb-tor1-01.ssh > 162.243.188.66.54220: Flags [P.], seq 3347280:3347344, ack 3841, win 501, options [nop,nop,TS val 1064876331 ecr 2946070972], length 64
17:17:54.012659 IP lamp-ubuntu-s-4vcpu-8gb-tor1-01.ssh > 162.243.188.66.54220: Flags [P.], seq 3347344:3347600, ack 3841, win 501, options [nop,nop,TS val 1064876331 ecr 2946070972], length 256
17:17:54.012684 IP lamp-ubuntu-s-4vcpu-8gb-tor1-01.ssh > 162.243.188.66.54220: Flags [P.], seq 3347600:3347856, ack 3841, win 501, options [nop,nop,TS val 1064876331 ecr 2946070972], length 256
17:17:54.012691 IP 162.243.188.66.54220 > lamp-ubuntu-s-4vcpu-8gb-tor1-01.ssh: Flags [.], ack 3220272, win 1015, options [nop,nop,TS val 2946070972 ecr 1064876317], length 0
17:17:54.012706 IP lamp-ubuntu-s-4vcpu-8gb-tor1-01.ssh > 162.243.188.66.54220: Flags [P.], seq 3347856:3348112, ack 3841, win 501, options [nop,nop,TS val 1064876331 ecr 2946070972], length 256
17:17:54.012726 IP lamp-ubuntu-s-4vcpu-8gb-tor1-01.ssh > 162.243.188.66.54220: Flags [P.], seq 3348112:3348368, ack 3841, win 501, options [nop,nop,TS val 1064876331 ecr 2946070972], length 256
17:17:54.012734 IP lamp-ubuntu-s-4vcpu-8gb-tor1-01.ssh > 162.243.188.66.54220: Flags [P.], seq 3348368:3348816, ack 3841, win 501, options [nop,nop,TS val 1064876331 ecr 2946070972], length 448
17:17:54.012774 IP lamp-ubuntu-s-4vcpu-8gb-tor1-01.ssh > 162.243.188.66.54220: Flags [P.], seq 3348816:3349056, ack 3841, win 501, options [nop,nop,TS val 1064876331 ecr 2946070972], length 240
17:17:54.012789 IP lamp-ubuntu-s-4vcpu-8gb-tor1-01.ssh > 162.243.188.66.54220: Flags [P.], seq 3349056:3349312, ack 3841, win 501, options [nop,nop,TS val 1064876331 ecr 2946070972], length 256
17:17:54.012804 IP lamp-ubuntu-s-4vcpu-8gb-tor1-01.ssh > 162.243.188.66.54220: Flags [P.], seq 3349312:3349760, ack 3841, win 501, options [nop,nop,TS val 1064876331 ecr 2946070972], length 448
17:17:54.012808 IP 162.243.188.66.54220 > lamp-ubuntu-s-4vcpu-8gb-tor1-01.ssh: Flags [.], ack 3221280, win 1015, options [nop,nop,TS val 2946070972 ecr 1064876317], length 0
17:17:54.012825 IP lamp-ubuntu-s-4vcpu-8gb-tor1-01.ssh > 162.243.188.66.54220: Flags [P.], seq 3349760:3349824, ack 3841, win 501, options [nop,nop,TS val 1064876331 ecr 2946070972], length 64
17:17:54.012839 IP lamp-ubuntu-s-4vcpu-8gb-tor1-01.ssh > 162.243.188.66.54220: Flags [P.], seq 3349824:3350080, ack 3841, win 501, options [nop,nop,TS val 1064876331 ecr 2946070972], length 256
17:17:54.012854 IP lamp-ubuntu-s-4vcpu-8gb-tor1-01.ssh > 162.243.188.66.54220: Flags [P.], seq 3350080:3350528, ack 3841, win 501, options [nop,nop,TS val 1064876331 ecr 2946070972], length 448
17:17:54.012872 IP lamp-ubuntu-s-4vcpu-8gb-tor1-01.ssh > 162.243.188.66.54220: Flags [P.], seq 3350528:3350592, ack 3841, win 501, options [nop,nop,TS val 1064876331 ecr 2946070972], length 64
17:17:54.012881 IP lamp-ubuntu-s-4vcpu-8gb-tor1-01.ssh > 162.243.188.66.54220: Flags [P.], seq 3350592:3350832, ack 3841, win 501, options [nop,nop,TS val 1064876331 ecr 2946070972], length 240
17:17:54.012910 IP lamp-ubuntu-s-4vcpu-8gb-tor1-01.ssh > 162.243.188.66.54220: Flags [P.], seq 3350832:3351088, ack 3841, win 501, options [nop,nop,TS val 1064876332 ecr 2946070972], length 256
17:17:54.012975 IP 162.243.188.66.54220 > lamp-ubuntu-s-4vcpu-8gb-tor1-01.ssh: Flags [.], ack 3222400, win 1015, options [nop,nop,TS val 2946070972 ecr 1064876317], length 0
17:17:54.012986 IP lamp-ubuntu-s-4vcpu-8gb-tor1-01.ssh > 162.243.188.66.54220: Flags [P.], seq 3351088:3352304, ack 3841, win 501, options [nop,nop,TS val 1064876332 ecr 2946070972], length 1216
17:17:54.013134 IP 162.243.188.66.54220 > lamp-ubuntu-s-4vcpu-8gb-tor1-01.ssh: Flags [.], ack 3223520, win 1015, options [nop,nop,TS val 2946070972 ecr 1064876317], length 0
17:17:54.013142 IP lamp-ubuntu-s-4vcpu-8gb-tor1-01.ssh > 162.243.188.66.54220: Flags [P.], seq 3352304:3352800, ack 3841, win 501, options [nop,nop,TS val 1064876332 ecr 2946070972], length 496
17:17:54.013172 IP lamp-ubuntu-s-4vcpu-8gb-tor1-01.ssh > 162.243.188.66.54220: Flags [P.], seq 3352800:3353040, ack 3841, win 501, options [nop,nop,TS val 1064876332 ecr 2946070972], length 240
17:17:54.013318 IP 162.243.188.66.54220 > lamp-ubuntu-s-4vcpu-8gb-tor1-01.ssh: Flags [.], ack 3224656, win 1015, options [nop,nop,TS val 2946070972 ecr 1064876318], length 0
17:17:54.013331 IP lamp-ubuntu-s-4vcpu-8gb-tor1-01.ssh > 162.243.188.66.54220: Flags [P.], seq 3353040:3353552, ack 3841, win 501, options [nop,nop,TS val 1064876332 ecr 2946070972], length 512
17:17:54.013356 IP lamp-ubuntu-s-4vcpu-8gb-tor1-01.ssh > 162.243.188.66.54220: Flags [P.], seq 3353552:3353792, ack 3841, win 501, options [nop,nop,TS val 1064876332 ecr 2946070972], length 240
17:17:54.013373 IP lamp-ubuntu-s-4vcpu-8gb-tor1-01.ssh > 162.243.188.66.54220: Flags [P.], seq 3353792:3354048, ack 3841, win 501, options [nop,nop,TS val 1064876332 ecr 2946070972], length 256
17:17:54.013394 IP lamp-ubuntu-s-4vcpu-8gb-tor1-01.ssh > 162.243.188.66.54220: Flags [P.], seq 3354048:3354304, ack 3841, win 501, options [nop,nop,TS val 1064876332 ecr 2946070972], length 256
17:17:54.013402 IP 162.243.188.66.54220 > lamp-ubuntu-s-4vcpu-8gb-tor1-01.ssh: Flags [.], ack 3225856, win 1015, options [nop,nop,TS val 2946070973 ecr 1064876318], length 0
17:17:54.013416 IP lamp-ubuntu-s-4vcpu-8gb-tor1-01.ssh > 162.243.188.66.54220: Flags [P.], seq 3354304:3354560, ack 3841, win 501, options [nop,nop,TS val 1064876332 ecr 2946070973], length 256
17:17:54.013434 IP lamp-ubuntu-s-4vcpu-8gb-tor1-01.ssh > 162.243.188.66.54220: Flags [P.], seq 3354560:3354624, ack 3841, win 501, options [nop,nop,TS val 1064876332 ecr 2946070973], length 64
17:17:54.013442 IP lamp-ubuntu-s-4vcpu-8gb-tor1-01.ssh > 162.243.188.66.54220: Flags [P.], seq 3354624:3354880, ack 3841, win 501, options [nop,nop,TS val 1064876332 ecr 2946070973], length 256
17:17:54.013491 IP lamp-ubuntu-s-4vcpu-8gb-tor1-01.ssh > 162.243.188.66.54220: Flags [P.], seq 3354880:3355120, ack 3841, win 501, options [nop,nop,TS val 1064876332 ecr 2946070973], length 240
17:17:54.013511 IP lamp-ubuntu-s-4vcpu-8gb-tor1-01.ssh > 162.243.188.66.54220: Flags [P.], seq 3355120:3355376, ack 3841, win 501, options [nop,nop,TS val 1064876332 ecr 2946070973], length 256
17:17:54.013540 IP 162.243.188.66.54220 > lamp-ubuntu-s-4vcpu-8gb-tor1-01.ssh: Flags [.], ack 3226976, win 1015, options [nop,nop,TS val 2946070973 ecr 1064876318], length 0
17:17:54.013547 IP lamp-ubuntu-s-4vcpu-8gb-tor1-01.ssh > 162.243.188.66.54220: Flags [P.], seq 3355376:3356016, ack 3841, win 501, options [nop,nop,TS val 1064876332 ecr 2946070973], length 640
17:17:54.013567 IP lamp-ubuntu-s-4vcpu-8gb-tor1-01.ssh > 162.243.188.66.54220: Flags [P.], seq 3356016:3356272, ack 3841, win 501, options [nop,nop,TS val 1064876332 ecr 2946070973], length 256
17:17:54.013587 IP lamp-ubuntu-s-4vcpu-8gb-tor1-01.ssh > 162.243.188.66.54220: Flags [P.], seq 3356272:3356496, ack 3841, win 501, options [nop,nop,TS val 1064876332 ecr 2946070973], length 224
17:17:54.013602 IP lamp-ubuntu-s-4vcpu-8gb-tor1-01.ssh > 162.243.188.66.54220: Flags [P.], seq 3356496:3356560, ack 3841, win 501, options [nop,nop,TS val 1064876332 ecr 2946070973], length 64
17:17:54.013644 IP lamp-ubuntu-s-4vcpu-8gb-tor1-01.ssh > 162.243.188.66.54220: Flags [P.], seq 3356560:3356816, ack 3841, win 501, options [nop,nop,TS val 1064876332 ecr 2946070973], length 256
17:17:54.013770 IP 162.243.188.66.54220 > lamp-ubuntu-s-4vcpu-8gb-tor1-01.ssh: Flags [.], ack 3228176, win 1015, options [nop,nop,TS val 2946070973 ecr 1064876318], length 0
17:17:54.013779 IP lamp-ubuntu-s-4vcpu-8gb-tor1-01.ssh > 162.243.188.66.54220: Flags [P.], seq 3356816:3357712, ack 3841, win 501, options [nop,nop,TS val 1064876332 ecr 2946070973], length 896
17:17:54.013819 IP lamp-ubuntu-s-4vcpu-8gb-tor1-01.ssh > 162.243.188.66.54220: Flags [P.], seq 3357712:3357952, ack 3841, win 501, options [nop,nop,TS val 1064876332 ecr 2946070973], length 240
17:17:54.014021 IP 162.243.188.66.54220 > lamp-ubuntu-s-4vcpu-8gb-tor1-01.ssh: Flags [.], ack 3229200, win 1015, options [nop,nop,TS val 2946070973 ecr 1064876318], length 0
17:17:54.014031 IP lamp-ubuntu-s-4vcpu-8gb-tor1-01.ssh > 162.243.188.66.54220: Flags [P.], seq 3357952:3358464, ack 3841, win 501, options [nop,nop,TS val 1064876333 ecr 2946070973], length 512
17:17:54.014081 IP lamp-ubuntu-s-4vcpu-8gb-tor1-01.ssh > 162.243.188.66.54220: Flags [P.], seq 3358464:3358896, ack 3841, win 501, options [nop,nop,TS val 1064876333 ecr 2946070973], length 432
17:17:54.014199 IP 162.243.188.66.54220 > lamp-ubuntu-s-4vcpu-8gb-tor1-01.ssh: Flags [.], ack 3230400, win 1015, options [nop,nop,TS val 2946070973 ecr 1064876318], length 0
17:17:54.014209 IP lamp-ubuntu-s-4vcpu-8gb-tor1-01.ssh > 162.243.188.66.54220: Flags [P.], seq 3358896:3359152, ack 3841, win 501, options [nop,nop,TS val 1064876333 ecr 2946070973], length 256
17:17:54.014243 IP lamp-ubuntu-s-4vcpu-8gb-tor1-01.ssh > 162.243.188.66.54220: Flags [P.], seq 3359152:3359392, ack 3841, win 501, options [nop,nop,TS val 1064876333 ecr 2946070973], length 240
17:17:54.014259 IP lamp-ubuntu-s-4vcpu-8gb-tor1-01.ssh > 162.243.188.66.54220: Flags [P.], seq 3359392:3359648, ack 3841, win 501, options [nop,nop,TS val 1064876333 ecr 2946070973], length 256
17:17:54.014292 IP lamp-ubuntu-s-4vcpu-8gb-tor1-01.ssh > 162.243.188.66.54220: Flags [P.], seq 3359648:3359904, ack 3841, win 501, options [nop,nop,TS val 1064876333 ecr 2946070973], length 256
17:17:54.014319 IP lamp-ubuntu-s-4vcpu-8gb-tor1-01.ssh > 162.243.188.66.54220: Flags [P.], seq 3359904:3360160, ack 3841, win 501, options [nop,nop,TS val 1064876333 ecr 2946070973], length 256
17:17:54.014343 IP 162.243.188.66.54220 > lamp-ubuntu-s-4vcpu-8gb-tor1-01.ssh: Flags [.], ack 3231424, win 1015, options [nop,nop,TS val 2946070973 ecr 1064876319], length 0
17:17:54.014369 IP lamp-ubuntu-s-4vcpu-8gb-tor1-01.ssh > 162.243.188.66.54220: Flags [P.], seq 3360160:3360416, ack 3841, win 501, options [nop,nop,TS val 1064876333 ecr 2946070973], length 256
17:17:54.014391 IP lamp-ubuntu-s-4vcpu-8gb-tor1-01.ssh > 162.243.188.66.54220: Flags [P.], seq 3360416:3360848, ack 3841, win 501, options [nop,nop,TS val 1064876333 ecr 2946070973], length 432
17:17:54.014414 IP lamp-ubuntu-s-4vcpu-8gb-tor1-01.ssh > 162.243.188.66.54220: Flags [P.], seq 3360848:3361104, ack 3841, win 501, options [nop,nop,TS val 1064876333 ecr 2946070973], length 256
17:17:54.014475 IP 162.243.188.66.54220 > lamp-ubuntu-s-4vcpu-8gb-tor1-01.ssh: Flags [.], ack 3232448, win 1015, options [nop,nop,TS val 2946070974 ecr 1064876319], length 0
17:17:54.014485 IP lamp-ubuntu-s-4vcpu-8gb-tor1-01.ssh > 162.243.188.66.54220: Flags [P.], seq 3361104:3361616, ack 3841, win 501, options [nop,nop,TS val 1064876333 ecr 2946070974], length 512
17:17:54.014518 IP lamp-ubuntu-s-4vcpu-8gb-tor1-01.ssh > 162.243.188.66.54220: Flags [P.], seq 3361616:3361856, ack 3841, win 501, options [nop,nop,TS val 1064876333 ecr 2946070974], length 240
17:17:54.014538 IP lamp-ubuntu-s-4vcpu-8gb-tor1-01.ssh > 162.243.188.66.54220: Flags [P.], seq 3361856:3362112, ack 3841, win 501, options [nop,nop,TS val 1064876333 ecr 2946070974], length 256
17:17:54.014676 IP 162.243.188.66.54220 > lamp-ubuntu-s-4vcpu-8gb-tor1-01.ssh: Flags [.], ack 3233472, win 1015, options [nop,nop,TS val 2946070974 ecr 1064876319], length 0
17:17:54.014688 IP lamp-ubuntu-s-4vcpu-8gb-tor1-01.ssh > 162.243.188.66.54220: Flags [P.], seq 3362112:3362560, ack 3841, win 501, options [nop,nop,TS val 1064876333 ecr 2946070974], length 448
17:17:54.014718 IP lamp-ubuntu-s-4vcpu-8gb-tor1-01.ssh > 162.243.188.66.54220: Flags [P.], seq 3362560:3362800, ack 3841, win 501, options [nop,nop,TS val 1064876333 ecr 2946070974], length 240
17:17:54.014746 IP lamp-ubuntu-s-4vcpu-8gb-tor1-01.ssh > 162.243.188.66.54220: Flags [P.], seq 3362800:3363056, ack 3841, win 501, options [nop,nop,TS val 1064876333 ecr 2946070974], length 256
17:17:54.014781 IP lamp-ubuntu-s-4vcpu-8gb-tor1-01.ssh > 162.243.188.66.54220: Flags [P.], seq 3363056:3363312, ack 3841, win 501, options [nop,nop,TS val 1064876333 ecr 2946070974], length 256
17:17:54.014888 IP 162.243.188.66.54220 > lamp-ubuntu-s-4vcpu-8gb-tor1-01.ssh: Flags [.], ack 3234672, win 1015, options [nop,nop,TS val 2946070974 ecr 1064876319], length 0
17:17:54.014897 IP lamp-ubuntu-s-4vcpu-8gb-tor1-01.ssh > 162.243.188.66.54220: Flags [P.], seq 3363312:3363824, ack 3841, win 501, options [nop,nop,TS val 1064876333 ecr 2946070974], length 512
17:17:54.014937 IP lamp-ubuntu-s-4vcpu-8gb-tor1-01.ssh > 162.243.188.66.54220: Flags [P.], seq 3363824:3364064, ack 3841, win 501, options [nop,nop,TS val 1064876334 ecr 2946070974], length 240
17:17:54.014958 IP lamp-ubuntu-s-4vcpu-8gb-tor1-01.ssh > 162.243.188.66.54220: Flags [P.], seq 3364064:3364320, ack 3841, win 501, options [nop,nop,TS val 1064876334 ecr 2946070974], length 256
17:17:54.015141 IP 162.243.188.66.54220 > lamp-ubuntu-s-4vcpu-8gb-tor1-01.ssh: Flags [.], ack 3235696, win 1015, options [nop,nop,TS val 2946070974 ecr 1064876319], length 0
17:17:54.015150 IP lamp-ubuntu-s-4vcpu-8gb-tor1-01.ssh > 162.243.188.66.54220: Flags [P.], seq 3364320:3364768, ack 3841, win 501, options [nop,nop,TS val 1064876334 ecr 2946070974], length 448
17:17:54.015186 IP lamp-ubuntu-s-4vcpu-8gb-tor1-01.ssh > 162.243.188.66.54220: Flags [P.], seq 3364768:3365008, ack 3841, win 501, options [nop,nop,TS val 1064876334 ecr 2946070974], length 240
17:17:54.015202 IP lamp-ubuntu-s-4vcpu-8gb-tor1-01.ssh > 162.243.188.66.54220: Flags [P.], seq 3365008:3365264, ack 3841, win 501, options [nop,nop,TS val 1064876334 ecr 2946070974], length 256
17:17:54.015236 IP lamp-ubuntu-s-4vcpu-8gb-tor1-01.ssh > 162.243.188.66.54220: Flags [P.], seq 3365264:3365520, ack 3841, win 501, options [nop,nop,TS val 1064876334 ecr 2946070974], length 256
17:17:54.015278 IP 162.243.188.66.54220 > lamp-ubuntu-s-4vcpu-8gb-tor1-01.ssh: Flags [.], ack 3236704, win 1015, options [nop,nop,TS val 2946070974 ecr 1064876320], length 0
17:17:54.015286 IP lamp-ubuntu-s-4vcpu-8gb-tor1-01.ssh > 162.243.188.66.54220: Flags [P.], seq 3365520:3366032, ack 3841, win 501, options [nop,nop,TS val 1064876334 ecr 2946070974], length 512
17:17:54.015321 IP lamp-ubuntu-s-4vcpu-8gb-tor1-01.ssh > 162.243.188.66.54220: Flags [P.], seq 3366032:3366272, ack 3841, win 501, options [nop,nop,TS val 1064876334 ecr 2946070974], length 240
17:17:54.015337 IP lamp-ubuntu-s-4vcpu-8gb-tor1-01.ssh > 162.243.188.66.54220: Flags [P.], seq 3366272:3366528, ack 3841, win 501, options [nop,nop,TS val 1064876334 ecr 2946070974], length 256
17:17:54.015409 IP 162.243.188.66.54220 > lamp-ubuntu-s-4vcpu-8gb-tor1-01.ssh: Flags [.], ack 3237728, win 1015, options [nop,nop,TS val 2946070975 ecr 1064876320], length 0
17:17:54.015418 IP lamp-ubuntu-s-4vcpu-8gb-tor1-01.ssh > 162.243.188.66.54220: Flags [P.], seq 3366528:3367040, ack 3841, win 501, options [nop,nop,TS val 1064876334 ecr 2946070975], length 512
17:17:54.015452 IP lamp-ubuntu-s-4vcpu-8gb-tor1-01.ssh > 162.243.188.66.54220: Flags [P.], seq 3367040:3367280, ack 3841, win 501, options [nop,nop,TS val 1064876334 ecr 2946070975], length 240
17:17:54.015469 IP lamp-ubuntu-s-4vcpu-8gb-tor1-01.ssh > 162.243.188.66.54220: Flags [P.], seq 3367280:3367536, ack 3841, win 501, options [nop,nop,TS val 1064876334 ecr 2946070975], length 256
17:17:54.015533 IP 162.243.188.66.54220 > lamp-ubuntu-s-4vcpu-8gb-tor1-01.ssh: Flags [.], ack 3238864, win 1015, options [nop,nop,TS val 2946070975 ecr 1064876320], length 0
17:17:54.015541 IP lamp-ubuntu-s-4vcpu-8gb-tor1-01.ssh > 162.243.188.66.54220: Flags [P.], seq 3367536:3368048, ack 3841, win 501, options [nop,nop,TS val 1064876334 ecr 2946070975], length 512
17:17:54.015583 IP lamp-ubuntu-s-4vcpu-8gb-tor1-01.ssh > 162.243.188.66.54220: Flags [P.], seq 3368048:3368480, ack 3841, win 501, options [nop,nop,TS val 1064876334 ecr 2946070975], length 432
17:17:54.015624 IP lamp-ubuntu-s-4vcpu-8gb-tor1-01.ssh > 162.243.188.66.54220: Flags [P.], seq 3368480:3368736, ack 3841, win 501, options [nop,nop,TS val 1064876334 ecr 2946070975], length 256
17:17:54.015724 IP 162.243.188.66.54220 > lamp-ubuntu-s-4vcpu-8gb-tor1-01.ssh: Flags [.], ack 3239952, win 1015, options [nop,nop,TS val 2946070975 ecr 1064876320], length 0
17:17:54.015737 IP lamp-ubuntu-s-4vcpu-8gb-tor1-01.ssh > 162.243.188.66.54220: Flags [P.], seq 3368736:3368992, ack 3841, win 501, options [nop,nop,TS val 1064876334 ecr 2946070975], length 256
17:17:54.015774 IP lamp-ubuntu-s-4vcpu-8gb-tor1-01.ssh > 162.243.188.66.54220: Flags [P.], seq 3368992:3369424, ack 3841, win 501, options [nop,nop,TS val 1064876334 ecr 2946070975], length 432
17:17:54.015801 IP lamp-ubuntu-s-4vcpu-8gb-tor1-01.ssh > 162.243.188.66.54220: Flags [P.], seq 3369424:3369488, ack 3841, win 501, options [nop,nop,TS val 1064876334 ecr 2946070975], length 64
17:17:54.015842 IP lamp-ubuntu-s-4vcpu-8gb-tor1-01.ssh > 162.243.188.66.54220: Flags [P.], seq 3369488:3369744, ack 3841, win 501, options [nop,nop,TS val 1064876334 ecr 2946070975], length 256
17:17:54.015914 IP 162.243.188.66.54220 > lamp-ubuntu-s-4vcpu-8gb-tor1-01.ssh: Flags [.], ack 3240976, win 1015, options [nop,nop,TS val 2946070975 ecr 1064876320], length 0
17:17:54.015925 IP lamp-ubuntu-s-4vcpu-8gb-tor1-01.ssh > 162.243.188.66.54220: Flags [P.], seq 3369744:3370256, ack 3841, win 501, options [nop,nop,TS val 1064876335 ecr 2946070975], length 512
17:17:54.015954 IP lamp-ubuntu-s-4vcpu-8gb-tor1-01.ssh > 162.243.188.66.54220: Flags [P.], seq 3370256:3370496, ack 3841, win 501, options [nop,nop,TS val 1064876335 ecr 2946070975], length 240
17:17:54.015995 IP lamp-ubuntu-s-4vcpu-8gb-tor1-01.ssh > 162.243.188.66.54220: Flags [P.], seq 3370496:3370752, ack 3841, win 501, options [nop,nop,TS val 1064876335 ecr 2946070975], length 256
17:17:54.016067 IP 162.243.188.66.54220 > lamp-ubuntu-s-4vcpu-8gb-tor1-01.ssh: Flags [.], ack 3242000, win 1015, options [nop,nop,TS val 2946070975 ecr 1064876320], length 0
17:17:54.016079 IP lamp-ubuntu-s-4vcpu-8gb-tor1-01.ssh > 162.243.188.66.54220: Flags [P.], seq 3370752:3371264, ack 3841, win 501, options [nop,nop,TS val 1064876335 ecr 2946070975], length 512
17:17:54.016122 IP lamp-ubuntu-s-4vcpu-8gb-tor1-01.ssh > 162.243.188.66.54220: Flags [P.], seq 3371264:3371696, ack 3841, win 501, options [nop,nop,TS val 1064876335 ecr 2946070975], length 432
17:17:54.016192 IP 162.243.188.66.54220 > lamp-ubuntu-s-4vcpu-8gb-tor1-01.ssh: Flags [.], ack 3243024, win 1015, options [nop,nop,TS val 2946070975 ecr 1064876320], length 0
17:17:54.016206 IP lamp-ubuntu-s-4vcpu-8gb-tor1-01.ssh > 162.243.188.66.54220: Flags [P.], seq 3371696:3371952, ack 3841, win 501, options [nop,nop,TS val 1064876335 ecr 2946070975], length 256
17:17:54.016229 IP lamp-ubuntu-s-4vcpu-8gb-tor1-01.ssh > 162.243.188.66.54220: Flags [P.], seq 3371952:3372384, ack 3841, win 501, options [nop,nop,TS val 1064876335 ecr 2946070975], length 432
17:17:54.016273 IP lamp-ubuntu-s-4vcpu-8gb-tor1-01.ssh > 162.243.188.66.54220: Flags [P.], seq 3372384:3372640, ack 3841, win 501, options [nop,nop,TS val 1064876335 ecr 2946070975], length 256
17:17:54.016316 IP lamp-ubuntu-s-4vcpu-8gb-tor1-01.ssh > 162.243.188.66.54220: Flags [P.], seq 3372640:3372896, ack 3841, win 501, options [nop,nop,TS val 1064876335 ecr 2946070975], length 256
17:17:54.016339 IP 162.243.188.66.54220 > lamp-ubuntu-s-4vcpu-8gb-tor1-01.ssh: Flags [.], ack 3244048, win 1015, options [nop,nop,TS val 2946070975 ecr 1064876321], length 0
17:17:54.016361 IP lamp-ubuntu-s-4vcpu-8gb-tor1-01.ssh > 162.243.188.66.54220: Flags [P.], seq 3372896:3373152, ack 3841, win 501, options [nop,nop,TS val 1064876335 ecr 2946070975], length 256
17:17:54.016383 IP lamp-ubuntu-s-4vcpu-8gb-tor1-01.ssh > 162.243.188.66.54220: Flags [P.], seq 3373152:3373392, ack 3841, win 501, options [nop,nop,TS val 1064876335 ecr 2946070975], length 240
17:17:54.016423 IP lamp-ubuntu-s-4vcpu-8gb-tor1-01.ssh > 162.243.188.66.54220: Flags [P.], seq 3373392:3373648, ack 3841, win 501, options [nop,nop,TS val 1064876335 ecr 2946070975], length 256
17:17:54.016445 IP lamp-ubuntu-s-4vcpu-8gb-tor1-01.ssh > 162.243.188.66.54220: Flags [P.], seq 3373648:3373904, ack 3841, win 501, options [nop,nop,TS val 1064876335 ecr 2946070975], length 256
17:17:54.016532 IP 162.243.188.66.54220 > lamp-ubuntu-s-4vcpu-8gb-tor1-01.ssh: Flags [.], ack 3245072, win 1015, options [nop,nop,TS val 2946070976 ecr 1064876321], length 0
17:17:54.016546 IP lamp-ubuntu-s-4vcpu-8gb-tor1-01.ssh > 162.243.188.66.54220: Flags [P.], seq 3373904:3374416, ack 3841, win 501, options [nop,nop,TS val 1064876335 ecr 2946070976], length 512
17:17:54.016574 IP lamp-ubuntu-s-4vcpu-8gb-tor1-01.ssh > 162.243.188.66.54220: Flags [P.], seq 3374416:3374848, ack 3841, win 501, options [nop,nop,TS val 1064876335 ecr 2946070976], length 432
17:17:54.016595 IP lamp-ubuntu-s-4vcpu-8gb-tor1-01.ssh > 162.243.188.66.54220: Flags [P.], seq 3374848:3374912, ack 3841, win 501, options [nop,nop,TS val 1064876335 ecr 2946070976], length 64
17:17:54.016659 IP 162.243.188.66.54220 > lamp-ubuntu-s-4vcpu-8gb-tor1-01.ssh: Flags [.], ack 3246080, win 1015, options [nop,nop,TS val 2946070976 ecr 1064876321], length 0
17:17:54.016667 IP lamp-ubuntu-s-4vcpu-8gb-tor1-01.ssh > 162.243.188.66.54220: Flags [P.], seq 3374912:3375424, ack 3841, win 501, options [nop,nop,TS val 1064876335 ecr 2946070976], length 512
17:17:54.016701 IP lamp-ubuntu-s-4vcpu-8gb-tor1-01.ssh > 162.243.188.66.54220: Flags [P.], seq 3375424:3375664, ack 3841, win 501, options [nop,nop,TS val 1064876335 ecr 2946070976], length 240
17:17:54.016720 IP lamp-ubuntu-s-4vcpu-8gb-tor1-01.ssh > 162.243.188.66.54220: Flags [P.], seq 3375664:3375920, ack 3841, win 501, options [nop,nop,TS val 1064876335 ecr 2946070976], length 256
17:17:54.016741 IP 162.243.188.66.54220 > lamp-ubuntu-s-4vcpu-8gb-tor1-01.ssh: Flags [.], ack 3247104, win 1015, options [nop,nop,TS val 2946070976 ecr 1064876321], length 0
17:17:54.016749 IP lamp-ubuntu-s-4vcpu-8gb-tor1-01.ssh > 162.243.188.66.54220: Flags [P.], seq 3375920:3376176, ack 3841, win 501, options [nop,nop,TS val 1064876335 ecr 2946070976], length 256
17:17:54.016781 IP lamp-ubuntu-s-4vcpu-8gb-tor1-01.ssh > 162.243.188.66.54220: Flags [P.], seq 3376176:3376432, ack 3841, win 501, options [nop,nop,TS val 1064876335 ecr 2946070976], length 256
17:17:54.016803 IP lamp-ubuntu-s-4vcpu-8gb-tor1-01.ssh > 162.243.188.66.54220: Flags [P.], seq 3376432:3376672, ack 3841, win 501, options [nop,nop,TS val 1064876335 ecr 2946070976], length 240
17:17:54.016812 IP lamp-ubuntu-s-4vcpu-8gb-tor1-01.ssh > 162.243.188.66.54220: Flags [P.], seq 3376672:3376928, ack 3841, win 501, options [nop,nop,TS val 1064876335 ecr 2946070976], length 256
17:17:54.016845 IP 162.243.188.66.54220 > lamp-ubuntu-s-4vcpu-8gb-tor1-01.ssh: Flags [.], ack 3248160, win 1015, options [nop,nop,TS val 2946070976 ecr 1064876321], length 0
17:17:54.016858 IP lamp-ubuntu-s-4vcpu-8gb-tor1-01.ssh > 162.243.188.66.54220: Flags [P.], seq 3376928:3377184, ack 3841, win 501, options [nop,nop,TS val 1064876335 ecr 2946070976], length 256
17:17:54.016878 IP lamp-ubuntu-s-4vcpu-8gb-tor1-01.ssh > 162.243.188.66.54220: Flags [P.], seq 3377184:3377440, ack 3841, win 501, options [nop,nop,TS val 1064876335 ecr 2946070976], length 256
17:17:54.016886 IP lamp-ubuntu-s-4vcpu-8gb-tor1-01.ssh > 162.243.188.66.54220: Flags [P.], seq 3377440:3377872, ack 3841, win 501, options [nop,nop,TS val 1064876335 ecr 2946070976], length 432
17:17:54.016937 IP 162.243.188.66.54220 > lamp-ubuntu-s-4vcpu-8gb-tor1-01.ssh: Flags [.], ack 3249376, win 1015, options [nop,nop,TS val 2946070976 ecr 1064876321], length 0
17:17:54.016945 IP lamp-ubuntu-s-4vcpu-8gb-tor1-01.ssh > 162.243.188.66.54220: Flags [P.], seq 3377872:3378640, ack 3841, win 501, options [nop,nop,TS val 1064876336 ecr 2946070976], length 768
17:17:54.016987 IP lamp-ubuntu-s-4vcpu-8gb-tor1-01.ssh > 162.243.188.66.54220: Flags [P.], seq 3378640:3379072, ack 3841, win 501, options [nop,nop,TS val 1064876336 ecr 2946070976], length 432
17:17:54.017035 IP 162.243.188.66.54220 > lamp-ubuntu-s-4vcpu-8gb-tor1-01.ssh: Flags [.], ack 3250384, win 1015, options [nop,nop,TS val 2946070976 ecr 1064876321], length 0
17:17:54.017043 IP lamp-ubuntu-s-4vcpu-8gb-tor1-01.ssh > 162.243.188.66.54220: Flags [P.], seq 3379072:3379328, ack 3841, win 501, options [nop,nop,TS val 1064876336 ecr 2946070976], length 256
17:17:54.017078 IP lamp-ubuntu-s-4vcpu-8gb-tor1-01.ssh > 162.243.188.66.54220: Flags [P.], seq 3379328:3379568, ack 3841, win 501, options [nop,nop,TS val 1064876336 ecr 2946070976], length 240
17:17:54.017106 IP lamp-ubuntu-s-4vcpu-8gb-tor1-01.ssh > 162.243.188.66.54220: Flags [P.], seq 3379568:3379824, ack 3841, win 501, options [nop,nop,TS val 1064876336 ecr 2946070976], length 256
17:17:54.017128 IP 162.243.188.66.54220 > lamp-ubuntu-s-4vcpu-8gb-tor1-01.ssh: Flags [.], ack 3251584, win 1015, options [nop,nop,TS val 2946070976 ecr 1064876322], length 0
17:17:54.017134 IP lamp-ubuntu-s-4vcpu-8gb-tor1-01.ssh > 162.243.188.66.54220: Flags [P.], seq 3379824:3380080, ack 3841, win 501, options [nop,nop,TS val 1064876336 ecr 2946070976], length 256
17:17:54.017156 IP lamp-ubuntu-s-4vcpu-8gb-tor1-01.ssh > 162.243.188.66.54220: Flags [P.], seq 3380080:3380336, ack 3841, win 501, options [nop,nop,TS val 1064876336 ecr 2946070976], length 256
17:17:54.017196 IP lamp-ubuntu-s-4vcpu-8gb-tor1-01.ssh > 162.243.188.66.54220: Flags [P.], seq 3380336:3380576, ack 3841, win 501, options [nop,nop,TS val 1064876336 ecr 2946070976], length 240
17:17:54.017213 IP lamp-ubuntu-s-4vcpu-8gb-tor1-01.ssh > 162.243.188.66.54220: Flags [P.], seq 3380576:3381024, ack 3841, win 501, options [nop,nop,TS val 1064876336 ecr 2946070976], length 448
17:17:54.017227 IP lamp-ubuntu-s-4vcpu-8gb-tor1-01.ssh > 162.243.188.66.54220: Flags [P.], seq 3381024:3381280, ack 3841, win 501, options [nop,nop,TS val 1064876336 ecr 2946070976], length 256
17:17:54.017227 IP 162.243.188.66.54220 > lamp-ubuntu-s-4vcpu-8gb-tor1-01.ssh: Flags [.], ack 3252784, win 1015, options [nop,nop,TS val 2946070976 ecr 1064876322], length 0
17:17:54.017247 IP lamp-ubuntu-s-4vcpu-8gb-tor1-01.ssh > 162.243.188.66.54220: Flags [P.], seq 3381280:3381536, ack 3841, win 501, options [nop,nop,TS val 1064876336 ecr 2946070976], length 256
17:17:54.017280 IP lamp-ubuntu-s-4vcpu-8gb-tor1-01.ssh > 162.243.188.66.54220: Flags [P.], seq 3381536:3381792, ack 3841, win 501, options [nop,nop,TS val 1064876336 ecr 2946070976], length 256
17:17:54.017301 IP lamp-ubuntu-s-4vcpu-8gb-tor1-01.ssh > 162.243.188.66.54220: Flags [P.], seq 3381792:3382032, ack 3841, win 501, options [nop,nop,TS val 1064876336 ecr 2946070976], length 240
17:17:54.017310 IP lamp-ubuntu-s-4vcpu-8gb-tor1-01.ssh > 162.243.188.66.54220: Flags [P.], seq 3382032:3382480, ack 3841, win 501, options [nop,nop,TS val 1064876336 ecr 2946070976], length 448
17:17:54.017362 IP 162.243.188.66.54220 > lamp-ubuntu-s-4vcpu-8gb-tor1-01.ssh: Flags [.], ack 3254224, win 1015, options [nop,nop,TS val 2946070977 ecr 1064876322], length 0
17:17:54.017370 IP lamp-ubuntu-s-4vcpu-8gb-tor1-01.ssh > 162.243.188.66.54220: Flags [P.], seq 3382480:3382992, ack 3841, win 501, options [nop,nop,TS val 1064876336 ecr 2946070977], length 512
17:17:54.017398 IP lamp-ubuntu-s-4vcpu-8gb-tor1-01.ssh > 162.243.188.66.54220: Flags [P.], seq 3382992:3383216, ack 3841, win 501, options [nop,nop,TS val 1064876336 ecr 2946070977], length 224
17:17:54.017406 IP 162.243.188.66.54220 > lamp-ubuntu-s-4vcpu-8gb-tor1-01.ssh: Flags [.], ack 3255360, win 1015, options [nop,nop,TS val 2946070977 ecr 1064876322], length 0
17:17:54.017424 IP lamp-ubuntu-s-4vcpu-8gb-tor1-01.ssh > 162.243.188.66.54220: Flags [P.], seq 3383216:3383280, ack 3841, win 501, options [nop,nop,TS val 1064876336 ecr 2946070977], length 64
17:17:54.017432 IP lamp-ubuntu-s-4vcpu-8gb-tor1-01.ssh > 162.243.188.66.54220: Flags [P.], seq 3383280:3383536, ack 3841, win 501, options [nop,nop,TS val 1064876336 ecr 2946070977], length 256
17:17:54.017448 IP lamp-ubuntu-s-4vcpu-8gb-tor1-01.ssh > 162.243.188.66.54220: Flags [P.], seq 3383536:3383792, ack 3841, win 501, options [nop,nop,TS val 1064876336 ecr 2946070977], length 256
17:17:54.017464 IP lamp-ubuntu-s-4vcpu-8gb-tor1-01.ssh > 162.243.188.66.54220: Flags [P.], seq 3383792:3383856, ack 3841, win 501, options [nop,nop,TS val 1064876336 ecr 2946070977], length 64
17:17:54.017528 IP 162.243.188.66.54220 > lamp-ubuntu-s-4vcpu-8gb-tor1-01.ssh: Flags [.], ack 3256560, win 1015, options [nop,nop,TS val 2946070977 ecr 1064876322], length 0
17:17:54.017529 IP lamp-ubuntu-s-4vcpu-8gb-tor1-01.ssh > 162.243.188.66.54220: Flags [P.], seq 3383856:3384288, ack 3841, win 501, options [nop,nop,TS val 1064876336 ecr 2946070977], length 432
17:17:54.017549 IP lamp-ubuntu-s-4vcpu-8gb-tor1-01.ssh > 162.243.188.66.54220: Flags [P.], seq 3384288:3384928, ack 3841, win 501, options [nop,nop,TS val 1064876336 ecr 2946070977], length 640
17:17:54.017584 IP lamp-ubuntu-s-4vcpu-8gb-tor1-01.ssh > 162.243.188.66.54220: Flags [P.], seq 3384928:3385168, ack 3841, win 501, options [nop,nop,TS val 1064876336 ecr 2946070977], length 240
17:17:54.017598 IP 162.243.188.66.54220 > lamp-ubuntu-s-4vcpu-8gb-tor1-01.ssh: Flags [.], ack 3257760, win 1015, options [nop,nop,TS val 2946070977 ecr 1064876322], length 0
17:17:54.017600 IP lamp-ubuntu-s-4vcpu-8gb-tor1-01.ssh > 162.243.188.66.54220: Flags [P.], seq 3385168:3385424, ack 3841, win 501, options [nop,nop,TS val 1064876336 ecr 2946070977], length 256
17:17:54.017626 IP lamp-ubuntu-s-4vcpu-8gb-tor1-01.ssh > 162.243.188.66.54220: Flags [P.], seq 3385424:3385680, ack 3841, win 501, options [nop,nop,TS val 1064876336 ecr 2946070977], length 256
17:17:54.017645 IP lamp-ubuntu-s-4vcpu-8gb-tor1-01.ssh > 162.243.188.66.54220: Flags [P.], seq 3385680:3385936, ack 3841, win 501, options [nop,nop,TS val 1064876336 ecr 2946070977], length 256
17:17:54.017654 IP lamp-ubuntu-s-4vcpu-8gb-tor1-01.ssh > 162.243.188.66.54220: Flags [P.], seq 3385936:3386560, ack 3841, win 501, options [nop,nop,TS val 1064876336 ecr 2946070977], length 624
17:17:54.017672 IP 162.243.188.66.54220 > lamp-ubuntu-s-4vcpu-8gb-tor1-01.ssh: Flags [.], ack 3258944, win 1015, options [nop,nop,TS val 2946070977 ecr 1064876322], length 0
17:17:54.017695 IP lamp-ubuntu-s-4vcpu-8gb-tor1-01.ssh > 162.243.188.66.54220: Flags [P.], seq 3386560:3387008, ack 3841, win 501, options [nop,nop,TS val 1064876336 ecr 2946070977], length 448
17:17:54.017715 IP 162.243.188.66.54220 > lamp-ubuntu-s-4vcpu-8gb-tor1-01.ssh: Flags [.], ack 3259904, win 1015, options [nop,nop,TS val 2946070977 ecr 1064876322], length 0
17:17:54.017720 IP lamp-ubuntu-s-4vcpu-8gb-tor1-01.ssh > 162.243.188.66.54220: Flags [P.], seq 3387008:3387248, ack 3841, win 501, options [nop,nop,TS val 1064876336 ecr 2946070977], length 240
17:17:54.017727 IP lamp-ubuntu-s-4vcpu-8gb-tor1-01.ssh > 162.243.188.66.54220: Flags [P.], seq 3387248:3387504, ack 3841, win 501, options [nop,nop,TS val 1064876336 ecr 2946070977], length 256
17:17:54.017744 IP lamp-ubuntu-s-4vcpu-8gb-tor1-01.ssh > 162.243.188.66.54220: Flags [P.], seq 3387504:3387744, ack 3841, win 501, options [nop,nop,TS val 1064876336 ecr 2946070977], length 240
17:17:54.017777 IP lamp-ubuntu-s-4vcpu-8gb-tor1-01.ssh > 162.243.188.66.54220: Flags [P.], seq 3387744:3388192, ack 3841, win 501, options [nop,nop,TS val 1064876336 ecr 2946070977], length 448
17:17:54.017795 IP 162.243.188.66.54220 > lamp-ubuntu-s-4vcpu-8gb-tor1-01.ssh: Flags [.], ack 3260912, win 1015, options [nop,nop,TS val 2946070977 ecr 1064876322], length 0
17:17:54.017800 IP lamp-ubuntu-s-4vcpu-8gb-tor1-01.ssh > 162.243.188.66.54220: Flags [P.], seq 3388192:3388448, ack 3841, win 501, options [nop,nop,TS val 1064876336 ecr 2946070977], length 256
17:17:54.017818 IP lamp-ubuntu-s-4vcpu-8gb-tor1-01.ssh > 162.243.188.66.54220: Flags [P.], seq 3388448:3388704, ack 3841, win 501, options [nop,nop,TS val 1064876336 ecr 2946070977], length 256
17:17:54.017849 IP lamp-ubuntu-s-4vcpu-8gb-tor1-01.ssh > 162.243.188.66.54220: Flags [P.], seq 3388704:3388944, ack 3841, win 501, options [nop,nop,TS val 1064876336 ecr 2946070977], length 240
17:17:54.017864 IP lamp-ubuntu-s-4vcpu-8gb-tor1-01.ssh > 162.243.188.66.54220: Flags [P.], seq 3388944:3389200, ack 3841, win 501, options [nop,nop,TS val 1064876336 ecr 2946070977], length 256
17:17:54.017878 IP 162.243.188.66.54220 > lamp-ubuntu-s-4vcpu-8gb-tor1-01.ssh: Flags [.], ack 3261936, win 1015, options [nop,nop,TS val 2946070977 ecr 1064876322], length 0
17:17:54.017894 IP lamp-ubuntu-s-4vcpu-8gb-tor1-01.ssh > 162.243.188.66.54220: Flags [P.], seq 3389200:3389456, ack 3841, win 501, options [nop,nop,TS val 1064876336 ecr 2946070977], length 256
17:17:54.017915 IP lamp-ubuntu-s-4vcpu-8gb-tor1-01.ssh > 162.243.188.66.54220: Flags [P.], seq 3389456:3389968, ack 3841, win 501, options [nop,nop,TS val 1064876337 ecr 2946070977], length 512
17:17:54.017933 IP lamp-ubuntu-s-4vcpu-8gb-tor1-01.ssh > 162.243.188.66.54220: Flags [P.], seq 3389968:3390192, ack 3841, win 501, options [nop,nop,TS val 1064876337 ecr 2946070977], length 224
17:17:54.017942 IP lamp-ubuntu-s-4vcpu-8gb-tor1-01.ssh > 162.243.188.66.54220: Flags [P.], seq 3390192:3390448, ack 3841, win 501, options [nop,nop,TS val 1064876337 ecr 2946070977], length 256